### ISSUE TITLE
[v2.1.7] No connection with device or service since version V2.1.7 - Community parameter not migrated

### ISSUE THREAD

**Issue by Pandia22** [iobroker-community-adapters/ioBroker.snmp#163]
**Describe the bug**  
No connection with device or service since version V2.1.7

**To Reproduce**  
After restarting the adapter always the same behavior. Deleting, reinstalling and loading the old configuration does not help.

**Expected behavior**  
After upgrading the adapter from V0.5.0 to V2.1.7, no connection with device or service can be established.

**Screenshots & Logfiles**  
2022-09-05 10:09:33.539 - info: snmp.0 (10409) starting. Version 2.1.7 in /opt/iobroker/node_modules/iobroker.snmp, node: v16.17.0, js-controller: 4.0.23
2022-09-05 10:09:33.760 - info: snmp.0 (10409) adapter initializing, chunk size set to 20

**Versions:**  
 - Adapter version: V2.7.1
 - JS-Controller version: 4.0.23
 - Node version: V16.17.0
 - Operating system: docker, QNAP

**Additional context**  
Presumably, the existing configuration was not implemented correctly during the upgrade. Backup instance of version V0.5.0 works correctly.

**Comment by mcm1957** [comment]
a) Please add the complete log or confirm that there are no more than the two lines of logging visible in normal mode.
b) Please indicate whether the adapter is running or fails / shuts down.
c) Please enable debug logging for the instance and attach debug log output.

**Comment by Pandia22** [comment]
a) In normal mode only the two lines are displayed.
b) The adapter starts and remains on status "yellow".
c) Enclosed the debug log output: 
<html>
<body>


2022-09-05 11:27:22.326 - debug: snmp.0 (10155) Redis Objects: Use Redis connection: 127.0.0.1:9001
--
2022-09-05 11:27:22.433 - debug: snmp.0 (10155) Objects client ready ... initialize now
2022-09-05 11:27:22.491 - debug: snmp.0 (10155) Objects create System PubSub Client
2022-09-05 11:27:22.493 - debug: snmp.0 (10155) Objects create User PubSub Client
2022-09-05 11:27:22.650 - debug: snmp.0 (10155) Objects client initialize lua scripts
2022-09-05 11:27:22.719 - debug: snmp.0 (10155) Objects connected to redis: 127.0.0.1:9001
2022-09-05 11:27:22.800 - debug: snmp.0 (10155) Redis States: Use Redis connection: 127.0.0.1:9000
2022-09-05 11:27:22.842 - debug: snmp.0 (10155) States create System PubSub Client
2022-09-05 11:27:22.844 - debug: snmp.0 (10155) States create User PubSub Client
2022-09-05 11:27:22.939 - debug: snmp.0 (10155) States connected to redis: 127.0.0.1:9000
2022-09-05 11:27:23.279 - debug: snmp.0 (10155) Plugin sentry Initialize Plugin (enabled=true)
2022-09-05 11:27:25.553 - info: snmp.0 (10155) starting. Version 2.1.7 in /opt/iobroker/node_modules/iobroker.snmp, node: v16.17.0, js-controller: 4.0.23
2022-09-05 11:27:25.624 - debug: snmp.0 (10155) onReady triggered
2022-09-05 11:27:25.852 - debug: snmp.0 (10155) validateConfig - verifying oid-sets
2022-09-05 11:27:25.854 - debug: snmp.0 (10155) validateConfig - verifying authorization data
2022-09-05 11:27:25.855 - debug: snmp.0 (10155) validateConfig - verifying devices
2022-09-05 11:27:25.856 - debug: snmp.0 (10155) validateConfig - validation completed (checks passed)
2022-09-05 11:27:25.858 - info: snmp.0 (10155) adapter initializing, chunk size set to 20
2022-09-05 11:27:25.859 - debug: snmp.0 (10155) setupContices - initializing contices
2022-09-05 11:27:25.860 - debug: snmp.0 (10155) adding device "192.168.178.47" (192_168_178_47)
2022-09-05 11:27:25.862 - debug: snmp.0 (10155) oid chunk index 0 created
2022-09-05 11:27:25.863 - debug: snmp.0 (10155) oid "1.3.6.1.4.1.24681.1.2.1.0" (192_168_178_47.qnap_systemCPUUsage)
2022-09-05 11:27:25.864 - debug: snmp.0 (10155) oid "1.3.6.1.4.1.24681.1.2.2.0" (192_168_178_47.qnap_systemTotalMem)
2022-09-05 11:27:25.865 - debug: snmp.0 (10155) oid "1.3.6.1.4.1.24681.1.2.3.0" (192_168_178_47.qnap_systemFreeMem)
2022-09-05 11:27:25.866 - debug: snmp.0 (10155) oid "1.3.6.1.4.1.24681.1.2.5.0" (192_168_178_47.qnap_cpuTemperature)
2022-09-05 11:27:25.866 - debug: snmp.0 (10155) oid "1.3.6.1.4.1.24681.1.2.6.0" (192_168_178_47.qnap_systemTemperature)
2022-09-05 11:27:25.867 - debug: snmp.0 (10155) oid "1.3.6.1.4.1.24681.1.2.15.1.3.1" (192_168_178_47.qnap_systemFanSpeed)
2022-09-05 11:27:25.868 - debug: snmp.0 (10155) oid "1.3.6.1.4.1.24681.1.2.17.1.4.1" (192_168_178_47.qnap_HDDTotalSize)
2022-09-05 11:27:25.868 - debug: snmp.0 (10155) oid "1.3.6.1.4.1.24681.1.2.17.1.5.1" (192_168_178_47.qnap_HDDFreeSize)
2022-09-05 11:27:25.869 - debug: snmp.0 (10155) oid "1.3.6.1.4.1.24681.1.2.11.1.7.1" (192_168_178_47.qnap_HDDSmartInfo1)
2022-09-05 11:27:25.869 - debug: snmp.0 (10155) oid "1.3.6.1.4.1.24681.1.2.11.1.7.2" (192_168_178_47.qnap_HDDSmartInfo2)
2022-09-05 11:27:25.875 - debug: snmp.0 (10155) oid "1.3.6.1.4.1.24681.1.2.11.1.3.1" (192_168_178_47.qnap_HDDTemp1)
2022-09-05 11:27:25.875 - debug: snmp.0 (10155) oid "1.3.6.1.4.1.24681.1.2.11.1.3.2" (192_168_178_47.qnap_HDDTemp2)
2022-09-05 11:27:25.876 - debug: snmp.0 (10155) initAllObjects - initializing objects
2022-09-05 11:27:25.880 - debug: snmp.0 (10155) initdeviceObjects (192_168_178_47/192.168.178.47)
2022-09-05 11:27:25.881 - debug: snmp.0 (10155) initobject 192_168_178_47
2022-09-05 11:27:25.960 - debug: snmp.0 (10155) initobject 192_168_178_47.online
2022-09-05 11:27:25.965 - debug: snmp.0 (10155) initOidObjects (192_168_178_47.qnap_systemCPUUsage)
2022-09-05 11:27:25.966 - debug: snmp.0 (10155) initobject 192_168_178_47.qnap_systemCPUUsage
2022-09-05 11:27:25.972 - debug: snmp.0 (10155) initOidObjects (192_168_178_47.qnap_systemTotalMem)
2022-09-05 11:27:25.973 - debug: snmp.0 (10155) initobject 192_168_178_47.qnap_systemTotalMem
2022-09-05 11:27:25.995 - debug: snmp.0 (10155) initOidObjects (192_168_178_47.qnap_systemFreeMem)
2022-09-05 11:27:26.002 - debug: snmp.0 (10155) initobject 192_168_178_47.qnap_systemFreeMem
2022-09-05 11:27:26.011 - debug: snmp.0 (10155) initOidObjects (192_168_178_47.qnap_cpuTemperature)
2022-09-05 11:27:26.011 - debug: snmp.0 (10155) initobject 192_168_178_47.qnap_cpuTemperature
2022-09-05 11:27:26.099 - debug: snmp.0 (10155) initOidObjects (192_168_178_47.qnap_systemTemperature)
2022-09-05 11:27:26.099 - debug: snmp.0 (10155) initobject 192_168_178_47.qnap_systemTemperature
2022-09-05 11:27:26.119 - debug: snmp.0 (10155) initOidObjects (192_168_178_47.qnap_systemFanSpeed)
2022-09-05 11:27:26.122 - debug: snmp.0 (10155) initobject 192_168_178_47.qnap_systemFanSpeed
2022-09-05 11:27:26.151 - debug: snmp.0 (10155) initOidObjects (192_168_178_47.qnap_HDDTotalSize)
2022-09-05 11:27:26.152 - debug: snmp.0 (10155) initobject 192_168_178_47.qnap_HDDTotalSize
2022-09-05 11:27:26.211 - debug: snmp.0 (10155) initOidObjects (192_168_178_47.qnap_HDDFreeSize)
2022-09-05 11:27:26.212 - debug: snmp.0 (10155) initobject 192_168_178_47.qnap_HDDFreeSize
2022-09-05 11:27:26.226 - debug: snmp.0 (10155) initOidObjects (192_168_178_47.qnap_HDDSmartInfo1)
2022-09-05 11:27:26.227 - debug: snmp.0 (10155) initobject 192_168_178_47.qnap_HDDSmartInfo1
2022-09-05 11:27:26.237 - debug: snmp.0 (10155) initOidObjects (192_168_178_47.qnap_HDDSmartInfo2)
2022-09-05 11:27:26.240 - debug: snmp.0 (10155) initobject 192_168_178_47.qnap_HDDSmartInfo2
2022-09-05 11:27:26.251 - debug: snmp.0 (10155) initOidObjects (192_168_178_47.qnap_HDDTemp1)
2022-09-05 11:27:26.252 - debug: snmp.0 (10155) initobject 192_168_178_47.qnap_HDDTemp1
2022-09-05 11:27:26.263 - debug: snmp.0 (10155) initOidObjects (192_168_178_47.qnap_HDDTemp2)
2022-09-05 11:27:26.264 - debug: snmp.0 (10155) initobject 192_168_178_47.qnap_HDDTemp2
2022-09-05 11:27:26.274 - debug: snmp.0 (10155) initialization completed
2022-09-05 11:27:26.275 - debug: snmp.0 (10155) starting reader threads
2022-09-05 11:27:26.276 - debug: snmp.0 (10155) createSession - device 192_168_178_47 (192.168.178.47)
2022-09-05 11:27:26.282 - debug: snmp.0 (10155) readOIDs - device "192_168_178_47" (192.168.178.47)
2022-09-05 11:27:26.282 - debug: snmp.0 (10155) [192_168_178_47] processing oid chunk index 0
2022-09-05 11:27:26.284 - debug: snmp.0 (10155) readChunkOIDs - device "192_168_178_47" (192.168.178.47), chunk idx 0
2022-09-05 11:27:26.301 - debug: snmp.0 (10155) session for device "192_168_178_47" (192.168.178.47) created
2022-09-05 11:27:26.301 - debug: snmp.0 (10155) startconnection info updater
2022-09-05 11:27:26.301 - debug: snmp.0 (10155) startup completed
2022-09-05 11:27:41.304 - debug: snmp.0 (10155) handleConnectionInfo
2022-09-05 11:27:56.305 - debug: snmp.0 (10155) handleConnectionInfo
2022-09-05 11:28:11.306 - debug: snmp.0 (10155) handleConnectionInfo
2022-09-05 11:28:26.281 - debug: snmp.0 (10155) readOIDs - device "192_168_178_47" (192.168.178.47)
2022-09-05 11:28:26.282 - debug: snmp.0 (10155) [192_168_178_47] processing oid chunk index 0
2022-09-05 11:28:26.283 - debug: snmp.0 (10155) readChunkOIDs - device "192_168_178_47" (192.168.178.47), chunk idx 0
2022-09-05 11:28:26.307 - debug: snmp.0 (10155) handleConnectionInfo
2022-09-05 11:28:41.308 - debug: snmp.0 (10155) handleConnectionInfo
2022-09-05 11:28:56.309 - debug: snmp.0 (10155) handleConnectionInfo
2022-09-05 11:29:11.310 - debug: snmp.0 (10155) handleConnectionInfo
2022-09-05 11:29:26.283 - debug: snmp.0 (10155) readOIDs - device "192_168_178_47" (192.168.178.47)
2022-09-05 11:29:26.283 - debug: snmp.0 (10155) [192_168_178_47] processing oid chunk index 0
2022-09-05 11:29:26.284 - debug: snmp.0 (10155) readChunkOIDs - device "192_168_178_47" (192.168.178.47), chunk idx 0
2022-09-05 11:29:26.310 - debug: snmp.0 (10155) handleConnectionInfo
2022-09-05 11:29:26.320 - debug: snmp.0 (10155) [192_168_178_47] session.get completed for chunk index 0
2022-09-05 11:29:26.321 - debug: snmp.0 (10155) [192_168_178_47] session.get: RequestTimedOutError: Request timed out
2022-09-05 11:29:26.323 - info: snmp.0 (10155) [192_168_178_47] device disconnected - request timout
2022-09-05 11:29:26.335 - debug: snmp.0 (10155) [192_168_178_47] processing oid chunk index 0 completed
2022-09-05 11:29:26.354 - debug: snmp.0 (10155) handleConnectionInfo
2022-09-05 11:29:26.355 - debug: snmp.0 (10155) handleConnectionInfo
2022-09-05 11:29:41.312 - debug: snmp.0 (10155) handleConnectionInfo
2022-09-05 11:29:56.313 - debug: snmp.0 (10155) handleConnectionInfo
2022-09-05 11:30:11.315 - debug: snmp.0 (10155) handleConnectionInfo
2022-09-05 11:30:26.284 - debug: snmp.0 (10155) readOIDs - device "192_168_178_47" (192.168.178.47)
2022-09-05 11:30:26.285 - debug: snmp.0 (10155) [192_168_178_47] processing oid chunk index 0
2022-09-05 11:30:26.285 - debug: snmp.0 (10155) readChunkOIDs - device "192_168_178_47" (192.168.178.47), chunk idx 0
2022-09-05 11:30:26.288 - debug: snmp.0 (10155) [192_168_178_47] session.get completed for chunk index 0
2022-09-05 11:30:26.289 - debug: snmp.0 (10155) [192_168_178_47] session.get: RequestTimedOutError: Request timed out
2022-09-05 11:30:26.293 - debug: snmp.0 (10155) [192_168_178_47] processing oid chunk index 0 completed
2022-09-05 11:30:26.340 - debug: snmp.0 (10155) handleConnectionInfo
2022-09-05 11:30:41.341 - debug: snmp.0 (10155) handleConnectionInfo


</body>
</html>

**Comment by mcm1957** [comment]
Danke für die rasche Antwort.

Könntest du bitte noch die Config attachen? Entweder im Export Mode die local Daten auslesen oder über den Export Button in der Instanz Config ein json erstellen.

Das Timeout kommt mir ein wenig kurz vor. Sollte eigentlich ein paar Sekunden sein. Kannst du den Timeout Paramater ev. kurz checken? Wenn du den ursprünglich unter 1s hattest kann es sein, dass der bei der Umrechnung in Sekunden nun auf 0 truncated wird. (Nur so eine schnelle Idee ...)

2022-09-05 11:30:26.285 - debug: snmp.0 (10155) readChunkOIDs - device "192_168_178_47" (192.168.178.47), chunk idx 0
2022-09-05 11:30:26.288 - debug: snmp.0 (10155) [192_168_178_47] session.get completed for chunk index 0
2022-09-05 11:30:26.289 - debug: snmp.0 (10155) [192_168_178_47] session.get: RequestTimedOutError: Request timed out
2022-09-05 11:30:26.293 - debug: snmp.0 (10155) [192_168_178_47] processing oid chunk index 0 completed

Aber andrerseits gibts am Anfang auch ne Sequenz die "komisch" ist, da fehlt mir das session.get completed.

2022-09.get -05 11:27:26.275 - debug: snmp.0 (10155) starting reader threads
2022-09-05 11:27:26.276 - debug: snmp.0 (10155) createSession - device 192_168_178_47 (192.168.178.47)
2022-09-05 11:27:26.282 - debug: snmp.0 (10155) readOIDs - device "192_168_178_47" (192.168.178.47)
2022-09-05 11:27:26.282 - debug: snmp.0 (10155) [192_168_178_47] processing oid chunk index 0
2022-09-05 11:27:26.284 - debug: snmp.0 (10155) readChunkOIDs - device "192_168_178_47" (192.168.178.47), chunk idx 0
2022-09-05 11:27:26.301 - debug: snmp.0 (10155) session for device "192_168_178_47" (192.168.178.47) created
2022-09-05 11:27:26.301 - debug: snmp.0 (10155) startconnection info updater


Muss mir das im Code ansehen ob ich da was erkennen kann.

**Comment by Pandia22** [comment]
Der TimeOut-Parameter in der Config ist auf 60 Sekunden gesetzt.

Anbei der Inhalt der snmp.0.json:

{
  "authSets": [],
  "devs": [
    {
      "devAct": true,
      "devAuthId": "public",
      "devComm": "private",
      "devIpAddr": "192.168.178.47",
      "devName": "192_168_178_47",
      "devOidGroup": "set-1",
      "devPollIntvl": 60,
      "devRetryIntvl": 60,
      "devSnmpVers": "1",
      "devTimeout": 60
    }
  ],
  "oids": [
    {
      "oidAct": true,
      "oidGroup": "set-1",
      "oidName": "qnap_systemCPUUsage",
      "oidOid": ".1.3.6.1.4.1.24681.1.2.1.0",
      "oidOptional": false,
      "oidWriteable": false
    },
    {
      "oidAct": true,
      "oidGroup": "set-1",
      "oidName": "qnap_systemTotalMem",
      "oidOid": ".1.3.6.1.4.1.24681.1.2.2.0",
      "oidOptional": false,
      "oidWriteable": false
    },
    {
      "oidAct": true,
      "oidGroup": "set-1",
      "oidName": "qnap_systemFreeMem",
      "oidOid": ".1.3.6.1.4.1.24681.1.2.3.0",
      "oidOptional": false,
      "oidWriteable": false
    },
    {
      "oidAct": true,
      "oidGroup": "set-1",
      "oidName": "qnap_cpuTemperature",
      "oidOid": ".1.3.6.1.4.1.24681.1.2.5.0",
      "oidOptional": false,
      "oidWriteable": false
    },
    {
      "oidAct": true,
      "oidGroup": "set-1",
      "oidName": "qnap_systemTemperature",
      "oidOid": ".1.3.6.1.4.1.24681.1.2.6.0",
      "oidOptional": false,
      "oidWriteable": false
    },
    {
      "oidAct": true,
      "oidGroup": "set-1",
      "oidName": "qnap_systemFanSpeed",
      "oidOid": ".1.3.6.1.4.1.24681.1.2.15.1.3.1",
      "oidOptional": false,
      "oidWriteable": false
    },
    {
      "oidAct": true,
      "oidGroup": "set-1",
      "oidName": "qnap_HDDTotalSize",
      "oidOid": ".1.3.6.1.4.1.24681.1.2.17.1.4.1",
      "oidOptional": false,
      "oidWriteable": false
    },
    {
      "oidAct": true,
      "oidGroup": "set-1",
      "oidName": "qnap_HDDFreeSize",
      "oidOid": ".1.3.6.1.4.1.24681.1.2.17.1.5.1",
      "oidOptional": false,
      "oidWriteable": false
    },
    {
      "oidAct": true,
      "oidGroup": "set-1",
      "oidName": "qnap_HDDSmartInfo1",
      "oidOid": ".1.3.6.1.4.1.24681.1.2.11.1.7.1",
      "oidOptional": false,
      "oidWriteable": false
    },
    {
      "oidAct": true,
      "oidGroup": "set-1",
      "oidName": "qnap_HDDSmartInfo2",
      "oidOid": ".1.3.6.1.4.1.24681.1.2.11.1.7.2",
      "oidOptional": false,
      "oidWriteable": false
    },
    {
      "oidAct": true,
      "oidGroup": "set-1",
      "oidName": "qnap_HDDTemp1",
      "oidOid": ".1.3.6.1.4.1.24681.1.2.11.1.3.1",
      "oidOptional": false,
      "oidWriteable": false
    },
    {
      "oidAct": true,
      "oidGroup": "set-1",
      "oidName": "qnap_HDDTemp2",
      "oidOid": ".1.3.6.1.4.1.24681.1.2.11.1.3.2",
      "oidOptional": false,
      "oidWriteable": false
    }
  ],
  "cfgVers": "2.0",
  "optChunkSize": "20",
  "optUseName": false
}

**Comment by mcm1957** [comment]
Danke
Das sieht (leider) alles OK aus. Ich kann nichts erkennen was in der Config suspekt wäre.
Jetzt gehen mir mal zunächst die Ideen aus.

Da es ja am selben Rechner mit 0.5.0 geht kann man zu 99% ein Netzwerkproblem ausschließen. Andrerseits gibt es mehrere 100 Installationen ohne Probleme.  Der Gegentest mit 0.5.0 zeigt auch, dass alle OIDs gültig sein sollten. (Außerdem sollte da kein Timeout kommen).

Ich werde sobald ich an mein Testsystem kommen mal verschiedenes testen. Insbesondere die 3 identen Timer hab ich siccher noch nicht getestet. Wenn du Zeit und Lust hast, setz mal den Poll Timer höher als die beiden anderen. Zusätzlich kanst du noch probieren:
-) snmp v2c - wenn es das QNAP kann. SNMP V2 liefert Fehler getrennt je OID, SNMP V1 nur einen je Aufruf.  
-) alle OIDs bis auf eine OID disablen und testen ob es ev. doch an einer speziellen OID oder deren Wert liegt.

Direkten Verdacht hab ich im Moment keinen Sorry.
Meld mich wenn ich was neues sagen kann.

**Comment by mcm1957** [comment]
Test log:
Setting timers to 60 / 60 / 60 works normally. Test target Synology NAS DSM 6.x.

**Comment by Pandia22** [comment]
Noch ein paar Hinweise zur Infrastruktur. Das IOB-Master-System läuft als Docker auf dem QNAP NAS mit dem SNMP-Adapter der Version 2.1.7. Ein identisches IOB-Slave-System auf einem Raspberry Pi4. Der SNMP-Adapter auf dem Slave in der Version 0.5.0 läuft weiterhin ohne Probleme.

o Poll Timer auf dem Master auf 2 Minuten erhöht. -> Problem nicht gelöst
o SNMP auf V2 umgestellt -> Problem nicht gelöst
o OIDs bis auf ein OID deaktiviert -> Problem nicht gelöst

Kann ich ein Downgrade des Adapters auf dem Master ausführen?

Ich werde mal das Log auf dem NAS analysieren. Vielleicht gibt es hier neue Erkenntnisse.

**Comment by mcm1957** [comment]
Danke für die zusätzlichen Tests.

Gehe ich richtig in der Vermutung, dass auf dem Master vor dem Upgrade ebenfalls ein SNMP Adapter (0.5.0 od 1.x.x) gelaufen ist und funktioniert hat? Ansonsten wäre es natürlich zunächst sinnvoll die Netzwerkverbindung vom Docker zum QNAP zu testen. 

Downgrade ist an sich nur via Backup möglich, d.h. ein Downgrade / eine Installation des SNMP Adapters in einer älteren Version sollte möglich sein, aber die Config wird nicht migriert. Zum Downgrade würde ich vorschlagen:#

a) Backup des Gesammtsystem anlegen (Sicherheitsmaßnahme)
b) Aktuelle SNMP Config (Devices, OIDs, Namen,,,. sichern (Screenshots, Papier, ...)
b) SNMP Adapter löschen
c) alte Version installieren
d) Config entweder im Expertenmodus reinkopieren - sofern die Daten noch unter 0.5.0 oder 1.x.x gesichert wurden - oder manuell neu eingeben.  

Da - wenn ich es richtig sehe - die snmp v2.1.7 Instanz in einem Docker am selben QNAP läuft das per snmp abgefragt wird, 
wäre es ev. noch sinnvoll dieses Device zu disablen und testweise ein anderes Device (Drucker, Netzwerkgerät, ...) einzutragen. Nur um sicherzugehen, dass nicht das QNAP / QNAP Loopback hier mitspielt.

Sorry, im Moment bin ich eher ratlos. Ich kenne kein vergleichbares Problem. Ich werde das Thema nochmals ins Forum clonen - ev. gibts dann noch irgendein Feedback.

**Comment by mcm1957** [comment]
Ich habe die Basisinfo mal ins Forum gestellt:
https://forum.iobroker.net/topic/57579/adapter-snmp-v2-x-x-support-thread/14?_=1662529104489

Bitte ggF. dort weiter diskutieren zumindest solange kein greifbares / auf anderen Systemen reproduzierbares Fehlerbild existiert.

**Comment by Pandia22** [comment]
Vor dem Upgrade lief der SNMP Adapter auf dem Master in der Version 0.5.0 stabil. Alle Daten wurde korrekt ausgelesen. Es wurden keine sonstigen Veränderungen, außer das Upgrade auf V2.1.7, am System vorgenommen. Die Netzwerkverbindung vom Docker zum QNAP kann ausgeschlossen werden, da diverse andere Adapter die gleiche Netzwerkverbindung benutzen. Der Fehler jedoch nur beim SNMP-Adapter auftritt.

**Comment by Pandia22** [comment]
Neuer Testbericht: Downgrade des Adapters
o SNMP-Adapter V2.1.7 gelöscht
o SNMP-Adapter V0.5.0 installiert
o neue SNMP-Instanz hinzugefügt
o qnap_systemCPUUsage OID .1.3.6.1.4.1.24681.1.2.1.0 community = private hinzugefügt und aktiviert

Ergebnis: Der Adapter (V.0.5.0) baut die Verbindung korrekt auf und liefert kontinuierlich Daten.

**Comment by Pandia22** [comment]
Testbericht: Upgrade des Adapters auf dem Slave (Pi4)
o Upgrade SNMP-Adapter von V0.5.0 auf V2.1.7
o qnap_systemCPUUsage OID .1.3.6.1.4.1.24681.1.2.1.0 community = private hinzugefügt und aktiviert

Ergebnis: Nach dem Upgrade auf die Version V2.1.7 kann die Verbindung auch auf diesem Geräte nicht aufgebaut werden. Das Verhalten ist identisch zum Master unter QNAP/Docker.

Fazit: 
o QNAP/Docker kann als Fehlerquelle ausgeschlossen werden
o Fehler ist auf unterschiedlichen Systemen reproduzierbar
o Downgrade auf die Version V0.5.0 beseitigt den Fehler

Idee:
o Vielleicht gibt es eine Abhängigkeit zur Note JS Version? Auf beiden Systemen ist Note JS V16.17.0 installiert.

**Comment by micklafisch** [comment]
Hallo,
ich reihe mich hier mal ein. Update einer funktionierenden V1.0.0 auf 2.1.7 gemacht und es funktioniert nicht mehr. Downgrade durchgeführt, geht wieder.

Das System läuft bei mir auf einer Synology Docker Installation, Node.js: 16.15.1, NPM 8.11.0

**Comment by micklafisch** [comment]
Japp korrekt, identisches Problem - daher meinte ich "ich reihe mich mit ein" - war wohl etwas zu ungenau ausgedrückt. Sorry.

**Comment by mcm1957** [comment]
@micklafisch @Pandia22 
To get further information please consider capturing the data exchange between ioB system and target using tcpdump:

_sudo tcpdump -nni eth0 host <ipaddress of target> and port 161_

At least at (my) Raspberri Pi 4 this works and logs the data exchanged. For details see forum topic 
https://forum.iobroker.net/topic/57579/adapter-snmp-v2-x-x-support-thread/21

Target is to get some idea whether data is sent (or not even that) and when data is received. This could give a hint if data is blocked inside adater during sending or during receiving.

**Comment by Pandia22** [comment]
Testbericht: SNMP-Adapter v.2.1.7 unter Raspberry Pi4

Kommando: "sudo tcpdump -nni eth0 host 192.168.178.47 and port 161" auf Konsole ausgeführt.

Log-Auszug:

root@iobroker2-master:~# sudo tcpdump -nni eth0 host 192.168.178.47 and port 161
tcpdump: verbose output suppressed, use -v or -vv for full protocol decode
listening on eth0, link-type EN10MB (Ethernet), capture size 262144 bytes
16:43:48.206913 IP 192.168.178.50.58623 > 192.168.178.47.161:  GetRequest(72)  .1.3.6.1.4.1.24681.1.2.1.0 .1.3.6.1.4.1.24681.1.                                     2.15.1.3.1 .1.3.6.1.4.1.24681.1.2.11.1.3.2
16:43:48.208774 IP 192.168.178.50.58623 > 192.168.178.47.161:  GetRequest(72)  .1.3.6.1.4.1.24681.1.2.1.0 .1.3.6.1.4.1.24681.1.                                     2.15.1.3.1 .1.3.6.1.4.1.24681.1.2.11.1.3.2
16:44:48.206279 IP 192.168.178.50.58623 > 192.168.178.47.161:  GetRequest(72)  .1.3.6.1.4.1.24681.1.2.1.0 .1.3.6.1.4.1.24681.1.                                     2.15.1.3.1 .1.3.6.1.4.1.24681.1.2.11.1.3.2
16:44:48.207724 IP 192.168.178.50.58623 > 192.168.178.47.161:  GetRequest(72)  .1.3.6.1.4.1.24681.1.2.1.0 .1.3.6.1.4.1.24681.1.                                     2.15.1.3.1 .1.3.6.1.4.1.24681.1.2.11.1.3.2
16:45:48.206628 IP 192.168.178.50.58623 > 192.168.178.47.161:  GetRequest(72)  .1.3.6.1.4.1.24681.1.2.1.0 .1.3.6.1.4.1.24681.1.2.15.1.3.1 .1.3.6.1.4.1.24681.1.2.11.1.3.2
16:45:48.207593 IP 192.168.178.50.58623 > 192.168.178.47.161:  GetRequest(72)  .1.3.6.1.4.1.24681.1.2.1.0 .1.3.6.1.4.1.24681.1.2.15.1.3.1 .1.3.6.1.4.1.24681.1.2.11.1.3.2
16:46:48.207552 IP 192.168.178.50.58623 > 192.168.178.47.161:  GetRequest(72)  .1.3.6.1.4.1.24681.1.2.1.0 .1.3.6.1.4.1.24681.1.2.15.1.3.1 .1.3.6.1.4.1.24681.1.2.11.1.3.2
16:46:48.208456 IP 192.168.178.50.58623 > 192.168.178.47.161:  GetRequest(72)  .1.3.6.1.4.1.24681.1.2.1.0 .1.3.6.1.4.1.24681.1.2.15.1.3.1 .1.3.6.1.4.1.24681.1.2.11.1.3.2
16:47:48.209029 IP 192.168.178.50.58623 > 192.168.178.47.161:  GetRequest(72)  .1.3.6.1.4.1.24681.1.2.1.0 .1.3.6.1.4.1.24681.1.2.15.1.3.1 .1.3.6.1.4.1.24681.1.2.11.1.3.2
16:47:48.211113 IP 192.168.178.50.58623 > 192.168.178.47.161:  GetRequest(72)  .1.3.6.1.4.1.24681.1.2.1.0 .1.3.6.1.4.1.24681.1.2.15.1.3.1 .1.3.6.1.4.1.24681.1.2.11.1.3.2
16:48:48.208944 IP 192.168.178.50.58623 > 192.168.178.47.161:  GetRequest(71)  .1.3.6.1.4.1.24681.1.2.1.0 .1.3.6.1.4.1.24681.1.2.15.1.3.1 .1.3.6.1.4.1.24681.1.2.11.1.3.2
16:48:48.210680 IP 192.168.178.50.58623 > 192.168.178.47.161:  GetRequest(72)  .1.3.6.1.4.1.24681.1.2.1.0 .1.3.6.1.4.1.24681.1.2.15.1.3.1 .1.3.6.1.4.1.24681.1.2.11.1.3.2
16:49:48.209077 IP 192.168.178.50.58623 > 192.168.178.47.161:  GetRequest(72)  .1.3.6.1.4.1.24681.1.2.1.0 .1.3.6.1.4.1.24681.1.2.15.1.3.1 .1.3.6.1.4.1.24681.1.2.11.1.3.2
16:49:48.209994 IP 192.168.178.50.58623 > 192.168.178.47.161:  GetRequest(71)  .1.3.6.1.4.1.24681.1.2.1.0 .1.3.6.1.4.1.24681.1.2.15.1.3.1 .1.3.6.1.4.1.24681.1.2.11.1.3.2

**Comment by mcm1957** [comment]
@Pandia22 
Thanks very much.
The log shows that the adapter sends requests but never gets an answer. But this need not be the fault of the target device. The requests are sent much to fast one after the other assuming that you still have set a poll intervall of 60 (or 120) seconds.

I'll check the code

**Comment by Pandia22** [comment]
Testbericht: TCP-Dump SNMP-Adapter v.0.5.0 unter Raspberry Pi4 to QNAP

Timeout: 30, Retry: 30, Poll: 30 (or 60) seconds

Kommando: "sudo tcpdump -nni eth0 host 192.168.178.47 and port 161" auf Konsole ausgeführt.

Log-Auszug:

root@iobroker2-master:/opt/iobroker# sudo tcpdump -nni eth0 host 192.168.178.47 and port 161
tcpdump: verbose output suppressed, use -v or -vv for full protocol decode
listening on eth0, link-type EN10MB (Ethernet), capture size 262144 bytes
18:01:35.371805 IP 192.168.178.50.36416 > 192.168.178.47.161:  C="private" GetRequest(32)  .1.3.6.1.4.1.24681.1.2.1.0
18:01:41.126758 IP 192.168.178.47.161 > 192.168.178.50.36416:  C="private" GetResponse(38)  .1.3.6.1.4.1.24681.1.2.1.0                                      ="92.0 %"
18:02:05.371470 IP 192.168.178.50.36416 > 192.168.178.47.161:  C="private" GetRequest(32)  .1.3.6.1.4.1.24681.1.2.1.0
18:02:14.389891 IP 192.168.178.47.161 > 192.168.178.50.36416:  C="private" GetResponse(38)  .1.3.6.1.4.1.24681.1.2.1.0                                      ="89.3 %"
18:02:35.372732 IP 192.168.178.50.36416 > 192.168.178.47.161:  C="private" GetRequest(32)  .1.3.6.1.4.1.24681.1.2.1.0
18:02:38.012425 IP 192.168.178.47.161 > 192.168.178.50.36416:  C="private" GetResponse(38)  .1.3.6.1.4.1.24681.1.2.1.0="13.5 %"
18:03:05.373634 IP 192.168.178.50.36416 > 192.168.178.47.161:  C="private" GetRequest(32)  .1.3.6.1.4.1.24681.1.2.1.0
18:03:15.236597 IP 192.168.178.47.161 > 192.168.178.50.36416:  C="private" GetResponse(38)  .1.3.6.1.4.1.24681.1.2.1.0="60.2 %"
18:03:35.374156 IP 192.168.178.50.36416 > 192.168.178.47.161:  C="private" GetRequest(32)  .1.3.6.1.4.1.24681.1.2.1.0
18:03:47.210209 IP 192.168.178.47.161 > 192.168.178.50.36416:  C="private" GetResponse(38)  .1.3.6.1.4.1.24681.1.2.1.0="69.9 %"
18:04:05.374938 IP 192.168.178.50.36416 > 192.168.178.47.161:  C="private" GetRequest(32)  .1.3.6.1.4.1.24681.1.2.1.0
18:04:30.118671 IP 192.168.178.47.161 > 192.168.178.50.36416:  C="private" GetResponse(38)  .1.3.6.1.4.1.24681.1.2.1.0="89.3 %"
18:04:35.374849 IP 192.168.178.50.36416 > 192.168.178.47.161:  C="private" GetRequest(32)  .1.3.6.1.4.1.24681.1.2.1.0
18:04:41.306595 IP 192.168.178.47.161 > 192.168.178.50.36416:  C="private" GetResponse(38)  .1.3.6.1.4.1.24681.1.2.1.0="84.9 %"
18:05:05.375168 IP 192.168.178.50.36416 > 192.168.178.47.161:  C="private" GetRequest(32)  .1.3.6.1.4.1.24681.1.2.1.0
18:05:21.391952 IP 192.168.178.47.161 > 192.168.178.50.36416:  C="private" GetResponse(38)  .1.3.6.1.4.1.24681.1.2.1.0="96.7 %"

Fazit:
o gleiches System nur mit SNMP-Adapter v.0.5.0 -> Adpater: grün
o Werte werden von QNAP korrekt abgeholt und im IOB-Datenpunkt gespeicht

**Comment by mcm1957** [comment]
migration fixed with v2.1.8

**Comment by Pandia22** [comment]
@mcm1957: Congratulations!

The test with QNAP/Docker and Raspberry Pi4 with version 2.1.8 was successful. The connections are now established correctly again. I had set the community parameter to "private", deviating from the default. After the adjustment, the adapter works again without errors.

**Comment by mcm1957** [comment]
fixed with v2.1.8

**Comment by mcm1957** [comment]
For evidence only as entry got lost somehow:

Von: Pandia22 [mailto:notifications@github.com] 
Gesendet: Freitag, 9. September 2022 00:02
An: iobroker-community-adapters/ioBroker.snmp
Cc: mcm1957; Mention
Betreff: Re: [iobroker-community-adapters/ioBroker.snmp] [v2.1.7] No connection with device or service since version V2.1.7 - Community parameter not migrated (Issue #163)

[@mcm1957](https://github.com/mcm1957): Congratulations!
The test with QNAP/Docker and Raspberry Pi4 with version 2.1.8 was successful. The connections are now established correctly again. I had set the community parameter to "******", deviating from the default. After the adjustment, the adapter works again without errors.
